{
  "basics": {
    "name": "Sarah Chen",
    "email": "san.francisco@email.com",
    "phone": "(555) 123-4567",
    "location": {
      "city": "San Francisco",
      "region": "CA",
      "country": "USA"
    }
  },
  "skills": [
    {
      "category": "Architecture & Design",
      "keywords": [
        "Microservices",
        "Event-Driven Architecture",
        "Domain-Driven Design",
        "REST APIs"
      ]
    },
    {
      "category": "Cloud Platforms",
      "keywords": ["AWS", "Azure", "Google Cloud Platform"]
    },
    {
      "category": "Programming Languages",
      "keywords": ["Java", "Python", "Go", "JavaScript", "TypeScript"]
    }
  ],
  "experience": [
    {
      "company": "TechCorp Solutions",
      "position": "Senior Software Architect",
      "startDate": "2020-01-01",
      "endDate": "2024-01-10"
    },
    {
      "company": "DataFlow Systems",
      "position": "Lead Software Engineer",
      "startDate": "2016-01-01",
      "endDate": "2019-12-31",
      "technologies": [
        "Distributed Systems",
        "Microservices",
        "Cloud Migration"
      ]
    },
    {
      "company": "InnovateTech",
      "position": "Senior Software Engineer",
      "startDate": "2013-01-01",
      "endDate": "2015-12-31",
      "technologies": [
        "High-performance Computing",
        "Real-time Analytics",
        "Container Orchestration"
      ]
    }
  ],
  "education": [
    {
      "institution": "Stanford University",
      "degree": "Master of Science",
      "field": "Computer Science",
      "graduationDate": "2013-01-01",
      "specialization": "Distributed Systems and Machine Learning"
    },
    {
      "institution": "University of California, Berkeley",
      "degree": "Bachelor of Science",
      "field": "Computer Engineering",
      "graduationDate": "2011-01-01"
    }
  ],
  "certifications": [
    {
      "name": "AWS Solutions Architect - Professional"
    },
    {
      "name": "Google Cloud Architect"
    },
    {
      "name": "Certified Kubernetes Administrator"
    }
  ],
  "publications": [
    {
      "title": "Scalable Microservices Architecture",
      "publisher": "IEEE Cloud Computing Conference",
      "date": "2022-01-01"
    }
  ]
}
